{"test_class": {"identifier": "ShowcaseEntryPointTest", "superclass": "", "interfaces": "", "fields": [{"original_string": "@Mock\n    private AppConfigService appConfigService;", "modifier": "@Mock\n    private", "type": "AppConfigService", "declarator": "appConfigService", "var_name": "appConfigService"}, {"original_string": "private CallerMock<AppConfigService> appConfigServiceCallerMock;", "modifier": "private", "type": "CallerMock<AppConfigService>", "declarator": "appConfigServiceCallerMock", "var_name": "appConfigServiceCallerMock"}, {"original_string": "@Mock\n    private ActivityBeansCache activityBeansCache;", "modifier": "@Mock\n    private", "type": "ActivityBeansCache", "declarator": "activityBeansCache", "var_name": "activityBeansCache"}, {"original_string": "@Mock\n    private SyncBeanManager iocManager;", "modifier": "@Mock\n    private", "type": "SyncBeanManager", "declarator": "iocManager", "var_name": "iocManager"}, {"original_string": "@Mock\n    private User identity;", "modifier": "@Mock\n    private", "type": "User", "declarator": "identity", "var_name": "identity"}, {"original_string": "@Mock\n    private DefaultAdminPageHelper adminPageHelper;", "modifier": "@Mock\n    private", "type": "DefaultAdminPageHelper", "declarator": "adminPageHelper", "var_name": "adminPageHelper"}, {"original_string": "@Spy\n    private DefaultWorkbenchFeaturesMenusHelper menusHelper;", "modifier": "@Spy\n    private", "type": "DefaultWorkbenchFeaturesMenusHelper", "declarator": "menusHelper", "var_name": "menusHelper"}, {"original_string": "@Mock\n    private WorkbenchMegaMenuPresenter menuBar;", "modifier": "@Mock\n    private", "type": "WorkbenchMegaMenuPresenter", "declarator": "menuBar", "var_name": "menuBar"}, {"original_string": "@Mock\n    private DefaultWorkbenchErrorCallback defaultWorkbenchErrorCallback;", "modifier": "@Mock\n    private", "type": "DefaultWorkbenchErrorCallback", "declarator": "defaultWorkbenchErrorCallback", "var_name": "defaultWorkbenchErrorCallback"}, {"original_string": "private ShowcaseEntryPoint showcaseEntryPoint;", "modifier": "private", "type": "ShowcaseEntryPoint", "declarator": "showcaseEntryPoint", "var_name": "showcaseEntryPoint"}], "file": "jbpm-wb-showcase/src/test/java/org/jbpm/workbench/client/ShowcaseEntryPointTest.java"}, "test_case": {"identifier": "setupMenuTest", "parameters": "()", "modifiers": "@Test public", "return": "void", "body": "@Test\n    public void setupMenuTest() {\n        showcaseEntryPoint.setupMenu();\n\n        ArgumentCaptor<Menus> menusCaptor = ArgumentCaptor.forClass(Menus.class);\n        verify(menuBar).addMenus(menusCaptor.capture());\n\n        Menus menus = menusCaptor.getValue();\n\n        assertEquals(6,\n                     menus.getItems().size());\n\n        assertEquals(showcaseEntryPoint.constants.Authoring(),\n                     menus.getItems().get(0).getCaption());\n        assertEquals(showcaseEntryPoint.constants.Deploy(),\n                     menus.getItems().get(1).getCaption());\n        assertEquals(showcaseEntryPoint.constants.Process_Management(),\n                     menus.getItems().get(2).getCaption());\n        assertEquals(showcaseEntryPoint.constants.Work(),\n                     menus.getItems().get(3).getCaption());\n        assertEquals(showcaseEntryPoint.constants.Dashboards(),\n                     menus.getItems().get(4).getCaption());\n        assertEquals(showcaseEntryPoint.constants.Extensions(),\n                     menus.getItems().get(5).getCaption());\n\n        verify(menusHelper).addRolesMenuItems();\n        verify(menusHelper).addGroupsMenuItems();\n        verify(menusHelper).addWorkbenchConfigurationMenuItem();\n        verify(menusHelper).addUtilitiesMenuItems();\n    }", "signature": "void setupMenuTest()", "full_signature": "@Test public void setupMenuTest()", "class_method_signature": "ShowcaseEntryPointTest.setupMenuTest()", "testcase": true, "constructor": false, "invocations": ["setupMenu", "forClass", "addMenus", "verify", "capture", "getValue", "assertEquals", "size", "getItems", "assertEquals", "Authoring", "getCaption", "get", "getItems", "assertEquals", "Deploy", "getCaption", "get", "getItems", "assertEquals", "Process_Management", "getCaption", "get", "getItems", "assertEquals", "Work", "getCaption", "get", "getItems", "assertEquals", "Dashboards", "getCaption", "get", "getItems", "assertEquals", "Extensions", "getCaption", "get", "getItems", "addRolesMenuItems", "verify", "addGroupsMenuItems", "verify", "addWorkbenchConfigurationMenuItem", "verify", "addUtilitiesMenuItems", "verify"]}, "focal_class": {"identifier": "ShowcaseEntryPoint", "superclass": "extends DefaultWorkbenchEntryPoint", "interfaces": "", "fields": [{"original_string": "protected Constants constants = Constants.INSTANCE;", "modifier": "protected", "type": "Constants", "declarator": "constants = Constants.INSTANCE", "var_name": "constants"}, {"original_string": "protected org.jbpm.workbench.common.client.resources.i18n.Constants commonConstants = org.jbpm.workbench.common.client.resources.i18n.Constants.INSTANCE;", "modifier": "protected", "type": "org.jbpm.workbench.common.client.resources.i18n.Constants", "declarator": "commonConstants = org.jbpm.workbench.common.client.resources.i18n.Constants.INSTANCE", "var_name": "commonConstants"}, {"original_string": "protected SyncBeanManager iocManager;", "modifier": "protected", "type": "SyncBeanManager", "declarator": "iocManager", "var_name": "iocManager"}, {"original_string": "protected User identity;", "modifier": "protected", "type": "User", "declarator": "identity", "var_name": "identity"}, {"original_string": "protected DefaultWorkbenchFeaturesMenusHelper menusHelper;", "modifier": "protected", "type": "DefaultWorkbenchFeaturesMenusHelper", "declarator": "menusHelper", "var_name": "menusHelper"}, {"original_string": "protected WorkbenchMegaMenuPresenter menuBar;", "modifier": "protected", "type": "WorkbenchMegaMenuPresenter", "declarator": "menuBar", "var_name": "menuBar"}, {"original_string": "protected DefaultAdminPageHelper adminPageHelper;", "modifier": "protected", "type": "DefaultAdminPageHelper", "declarator": "adminPageHelper", "var_name": "adminPageHelper"}, {"original_string": "protected AppFormerJsBridge appFormerJsBridge;", "modifier": "protected", "type": "AppFormerJsBridge", "declarator": "appFormerJsBridge", "var_name": "appFormerJsBridge"}], "methods": [{"identifier": "ShowcaseEntryPoint", "parameters": "(final Caller<AppConfigService> appConfigService,\n                              final ActivityBeansCache activityBeansCache,\n                              final SyncBeanManager iocManager,\n                              final User identity,\n                              final DefaultAdminPageHelper adminPageHelper,\n                              final DefaultWorkbenchFeaturesMenusHelper menusHelper,\n                              final WorkbenchMegaMenuPresenter menuBar,\n                              final DefaultWorkbenchErrorCallback defaultWorkbenchErrorCallback,\n                              final AppFormerJsBridge appFormerJsBridge)", "modifiers": "@Inject public", "return": "", "signature": " ShowcaseEntryPoint(final Caller<AppConfigService> appConfigService,\n                              final ActivityBeansCache activityBeansCache,\n                              final SyncBeanManager iocManager,\n                              final User identity,\n                              final DefaultAdminPageHelper adminPageHelper,\n                              final DefaultWorkbenchFeaturesMenusHelper menusHelper,\n                              final WorkbenchMegaMenuPresenter menuBar,\n                              final DefaultWorkbenchErrorCallback defaultWorkbenchErrorCallback,\n                              final AppFormerJsBridge appFormerJsBridge)", "full_signature": "@Inject public  ShowcaseEntryPoint(final Caller<AppConfigService> appConfigService,\n                              final ActivityBeansCache activityBeansCache,\n                              final SyncBeanManager iocManager,\n                              final User identity,\n                              final DefaultAdminPageHelper adminPageHelper,\n                              final DefaultWorkbenchFeaturesMenusHelper menusHelper,\n                              final WorkbenchMegaMenuPresenter menuBar,\n                              final DefaultWorkbenchErrorCallback defaultWorkbenchErrorCallback,\n                              final AppFormerJsBridge appFormerJsBridge)", "class_method_signature": "ShowcaseEntryPoint.ShowcaseEntryPoint(final Caller<AppConfigService> appConfigService,\n                              final ActivityBeansCache activityBeansCache,\n                              final SyncBeanManager iocManager,\n                              final User identity,\n                              final DefaultAdminPageHelper adminPageHelper,\n                              final DefaultWorkbenchFeaturesMenusHelper menusHelper,\n                              final WorkbenchMegaMenuPresenter menuBar,\n                              final DefaultWorkbenchErrorCallback defaultWorkbenchErrorCallback,\n                              final AppFormerJsBridge appFormerJsBridge)", "testcase": false, "constructor": true}, {"identifier": "setup", "parameters": "()", "modifiers": "@PostConstruct protected", "return": "void", "signature": "void setup()", "full_signature": "@PostConstruct protected void setup()", "class_method_signature": "ShowcaseEntryPoint.setup()", "testcase": false, "constructor": false}, {"identifier": "setupMenu", "parameters": "()", "modifiers": "@Override protected", "return": "void", "signature": "void setupMenu()", "full_signature": "@Override protected void setupMenu()", "class_method_signature": "ShowcaseEntryPoint.setupMenu()", "testcase": false, "constructor": false}, {"identifier": "setupAdminPage", "parameters": "()", "modifiers": "@Override protected", "return": "void", "signature": "void setupAdminPage()", "full_signature": "@Override protected void setupAdminPage()", "class_method_signature": "ShowcaseEntryPoint.setupAdminPage()", "testcase": false, "constructor": false}, {"identifier": "getAuthoringViews", "parameters": "()", "modifiers": "protected", "return": "List<? extends MenuItem>", "signature": "List<? extends MenuItem> getAuthoringViews()", "full_signature": "protected List<? extends MenuItem> getAuthoringViews()", "class_method_signature": "ShowcaseEntryPoint.getAuthoringViews()", "testcase": false, "constructor": false}, {"identifier": "getProcessManagementViews", "parameters": "()", "modifiers": "protected", "return": "List<? extends MenuItem>", "signature": "List<? extends MenuItem> getProcessManagementViews()", "full_signature": "protected List<? extends MenuItem> getProcessManagementViews()", "class_method_signature": "ShowcaseEntryPoint.getProcessManagementViews()", "testcase": false, "constructor": false}, {"identifier": "getDeploymentViews", "parameters": "()", "modifiers": "protected", "return": "List<? extends MenuItem>", "signature": "List<? extends MenuItem> getDeploymentViews()", "full_signature": "protected List<? extends MenuItem> getDeploymentViews()", "class_method_signature": "ShowcaseEntryPoint.getDeploymentViews()", "testcase": false, "constructor": false}, {"identifier": "getWorkViews", "parameters": "()", "modifiers": "protected", "return": "List<? extends MenuItem>", "signature": "List<? extends MenuItem> getWorkViews()", "full_signature": "protected List<? extends MenuItem> getWorkViews()", "class_method_signature": "ShowcaseEntryPoint.getWorkViews()", "testcase": false, "constructor": false}, {"identifier": "getDashboardsViews", "parameters": "()", "modifiers": "protected", "return": "List<? extends MenuItem>", "signature": "List<? extends MenuItem> getDashboardsViews()", "full_signature": "protected List<? extends MenuItem> getDashboardsViews()", "class_method_signature": "ShowcaseEntryPoint.getDashboardsViews()", "testcase": false, "constructor": false}, {"identifier": "createBrandLogo", "parameters": "()", "modifiers": "@Produces @ApplicationScoped public", "return": "MainBrand", "signature": "MainBrand createBrandLogo()", "full_signature": "@Produces @ApplicationScoped public MainBrand createBrandLogo()", "class_method_signature": "ShowcaseEntryPoint.createBrandLogo()", "testcase": false, "constructor": false}], "file": "jbpm-wb-showcase/src/main/java/org/jbpm/workbench/client/ShowcaseEntryPoint.java"}, "focal_method": {"identifier": "setupMenu", "parameters": "()", "modifiers": "@Override protected", "return": "void", "body": "@Override\n    protected void setupMenu() {\n        final Menus menus = MenuFactory\n                .newTopLevelMenu(constants.Authoring()).withItems(getAuthoringViews()).endMenu()\n                .newTopLevelMenu(constants.Deploy()).withItems(getDeploymentViews()).endMenu()\n                .newTopLevelMenu(constants.Process_Management()).withItems(getProcessManagementViews()).endMenu()\n                .newTopLevelMenu(constants.Work()).withItems(getWorkViews()).endMenu()\n                .newTopLevelMenu(constants.Dashboards()).withItems(getDashboardsViews()).endMenu()\n                .newTopLevelMenu(constants.Extensions()).withItems(menusHelper.getExtensionsViews()).endMenu()\n                .build();\n\n        menuBar.addMenus(menus);\n\n        menusHelper.addRolesMenuItems();\n        menusHelper.addGroupsMenuItems();\n        menusHelper.addWorkbenchConfigurationMenuItem();\n        menusHelper.addUtilitiesMenuItems();\n    }", "signature": "void setupMenu()", "full_signature": "@Override protected void setupMenu()", "class_method_signature": "ShowcaseEntryPoint.setupMenu()", "testcase": false, "constructor": false, "invocations": ["build", "endMenu", "withItems", "newTopLevelMenu", "endMenu", "withItems", "newTopLevelMenu", "endMenu", "withItems", "newTopLevelMenu", "endMenu", "withItems", "newTopLevelMenu", "endMenu", "withItems", "newTopLevelMenu", "endMenu", "withItems", "newTopLevelMenu", "Authoring", "getAuthoringViews", "Deploy", "getDeploymentViews", "Process_Management", "getProcessManagementViews", "Work", "getWorkViews", "Dashboards", "getDashboardsViews", "Extensions", "getExtensionsViews", "addMenus", "addRolesMenuItems", "addGroupsMenuItems", "addWorkbenchConfigurationMenuItem", "addUtilitiesMenuItems"]}, "repository": {"repo_id": 5405905, "url": "https://github.com/kiegroup/jbpm-wb", "stars": 36, "created": "8/13/2012 11:08:21 PM +00:00", "updates": "2020-01-21T13:08:37+00:00", "fork": "False", "license": "licensed"}}