{"test_class": {"identifier": "EntityTagHeaderDelegateTest", "superclass": "", "interfaces": "", "fields": [], "file": "wink-common/src/test/java/org/apache/wink/common/internal/providers/header/EntityTagHeaderDelegateTest.java"}, "test_case": {"identifier": "testSerializeEtag", "parameters": "()", "modifiers": "@Test public", "return": "void", "body": "@Test\n    public void testSerializeEtag() {\n        RuntimeDelegate rd = RuntimeDelegate.getInstance();\n        HeaderDelegate<EntityTag> entityTagHeaderDelegate =\n            rd.createHeaderDelegate(EntityTag.class);\n        if (entityTagHeaderDelegate == null) {\n            fail(\"EntityTag header delegate is not regestered in RuntimeDelegateImpl\");\n        }\n\n        String entityTagString = \"12321-\\\"12321-123123\";\n        String expectedEntityTagString = \"\\\"\" + \"12321-\\\\\\\"12321-123123\" + \"\\\"\";\n\n        // Test Weak Entity Tag\n        EntityTag weakETag = new EntityTag(entityTagString, true);\n        String weakETagString = entityTagHeaderDelegate.toString(weakETag);\n\n        assertEquals(\"W/\" + expectedEntityTagString, weakETagString);\n\n        // Test String Entity Tag\n        EntityTag strongETag = new EntityTag(entityTagString, false);\n        String strongETagString = entityTagHeaderDelegate.toString(strongETag);\n\n        assertEquals(expectedEntityTagString, strongETagString);\n\n        // Negative test - Etag in null\n        try {\n            EntityTag eTag = null;\n            entityTagHeaderDelegate.toString(eTag);\n            fail(\"EntityTag is null - IllegalArgumentException must be thrown\");\n        } catch (IllegalArgumentException e) {\n        }\n\n    }", "signature": "void testSerializeEtag()", "full_signature": "@Test public void testSerializeEtag()", "class_method_signature": "EntityTagHeaderDelegateTest.testSerializeEtag()", "testcase": true, "constructor": false, "invocations": ["getInstance", "createHeaderDelegate", "fail", "toString", "assertEquals", "toString", "assertEquals", "toString", "fail"]}, "focal_class": {"identifier": "EntityTagHeaderDelegate", "superclass": "", "interfaces": "implements HeaderDelegate<EntityTag>", "fields": [{"original_string": "private static String WEAK = \"W/\";", "modifier": "private static", "type": "String", "declarator": "WEAK = \"W/\"", "var_name": "WEAK"}], "methods": [{"identifier": "fromString", "parameters": "(String eTag)", "modifiers": "public", "return": "EntityTag", "signature": "EntityTag fromString(String eTag)", "full_signature": "public EntityTag fromString(String eTag)", "class_method_signature": "EntityTagHeaderDelegate.fromString(String eTag)", "testcase": false, "constructor": false}, {"identifier": "toString", "parameters": "(EntityTag eTag)", "modifiers": "public", "return": "String", "signature": "String toString(EntityTag eTag)", "full_signature": "public String toString(EntityTag eTag)", "class_method_signature": "EntityTagHeaderDelegate.toString(EntityTag eTag)", "testcase": false, "constructor": false}], "file": "wink-common/src/main/java/org/apache/wink/common/internal/providers/header/EntityTagHeaderDelegate.java"}, "focal_method": {"identifier": "toString", "parameters": "(EntityTag eTag)", "modifiers": "public", "return": "String", "body": "public String toString(EntityTag eTag) {\n\n        if (eTag == null) {\n            throw new IllegalArgumentException(Messages.getMessage(\"variableIsNull\", \"eTag\")); //$NON-NLS-1$ //$NON-NLS-2$\n        }\n\n        StringBuilder builder = new StringBuilder();\n        if (eTag.isWeak()) {\n            builder.append(\"W/\"); //$NON-NLS-1$\n        }\n        builder.append('\"');\n        String value = eTag.getValue();\n        for (int i = 0; i < value.length(); i++) {\n            char c = value.charAt(i);\n            if (c == '\"')\n                builder.append('\\\\');\n            builder.append(c);\n        }\n        builder.append('\"');\n        return builder.toString();\n    }", "signature": "String toString(EntityTag eTag)", "full_signature": "public String toString(EntityTag eTag)", "class_method_signature": "EntityTagHeaderDelegate.toString(EntityTag eTag)", "testcase": false, "constructor": false, "invocations": ["getMessage", "isWeak", "append", "append", "getValue", "length", "charAt", "append", "append", "append", "toString"]}, "repository": {"repo_id": 247823, "url": "https://github.com/apache/attic-wink", "language": "Java", "is_fork": false, "fork_count": 22, "stargazer_count": 19, "size": 12479, "license": "licensed"}}