{"test_class": {"identifier": "OrderEntryConfigResource1_10Test", "superclass": "extends BaseModuleWebContextSensitiveTest", "interfaces": "", "fields": [{"original_string": "@Autowired\n\tprivate MainResourceController mainResourceController;", "modifier": "@Autowired\n\tprivate", "type": "MainResourceController", "declarator": "mainResourceController", "var_name": "mainResourceController"}, {"original_string": "@Mock\n\tprivate OrderService orderService;", "modifier": "@Mock\n\tprivate", "type": "OrderService", "declarator": "orderService", "var_name": "orderService"}], "file": "omod-1.10/src/test/java/org/openmrs/module/webservices/rest/web/v1_0/resource/openmrs1_10/OrderEntryConfigResource1_10Test.java"}, "test_case": {"identifier": "testGetAll", "parameters": "()", "modifiers": "@Test public", "return": "void", "body": "@Test\n\tpublic void testGetAll() throws Exception {\n\t\tConcept route = new Concept();\n\t\twhen(orderService.getDrugRoutes()).thenReturn(Arrays.asList(route));\n\t\tConcept dosingUnit = new Concept();\n\t\twhen(orderService.getDrugDosingUnits()).thenReturn(Arrays.asList(dosingUnit));\n\t\t\n\t\tMockHttpServletResponse response = new MockHttpServletResponse();\n\t\tSimpleObject config = mainResourceController.get(\"orderentryconfig\", new MockHttpServletRequest(), response);\n\t\t\n\t\tList<SimpleObject> temp = (List<SimpleObject>) config.get(\"drugRoutes\");\n\t\tassertThat(temp.size(), is(1));\n\t\tassertThat((String) temp.get(0).get(\"uuid\"), is(route.getUuid()));\n\t\t\n\t\ttemp = (List<SimpleObject>) config.get(\"drugDosingUnits\");\n\t\tassertThat(temp.size(), is(1));\n\t\tassertThat((String) temp.get(0).get(\"uuid\"), is(dosingUnit.getUuid()));\n\t}", "signature": "void testGetAll()", "full_signature": "@Test public void testGetAll()", "class_method_signature": "OrderEntryConfigResource1_10Test.testGetAll()", "testcase": true, "constructor": false, "invocations": ["thenReturn", "when", "getDrugRoutes", "asList", "thenReturn", "when", "getDrugDosingUnits", "asList", "get", "get", "assertThat", "size", "is", "assertThat", "get", "get", "is", "getUuid", "get", "assertThat", "size", "is", "assertThat", "get", "get", "is", "getUuid"]}, "focal_class": {"identifier": "OrderEntryConfigResource1_10", "superclass": "", "interfaces": "implements Listable", "fields": [], "methods": [{"identifier": "getAll", "parameters": "(RequestContext context)", "modifiers": "@Override public", "return": "SimpleObject", "signature": "SimpleObject getAll(RequestContext context)", "full_signature": "@Override public SimpleObject getAll(RequestContext context)", "class_method_signature": "OrderEntryConfigResource1_10.getAll(RequestContext context)", "testcase": false, "constructor": false}, {"identifier": "getUri", "parameters": "(Object instance)", "modifiers": "@Override public", "return": "String", "signature": "String getUri(Object instance)", "full_signature": "@Override public String getUri(Object instance)", "class_method_signature": "OrderEntryConfigResource1_10.getUri(Object instance)", "testcase": false, "constructor": false}], "file": "omod-1.10/src/main/java/org/openmrs/module/webservices/rest/web/v1_0/resource/openmrs1_10/OrderEntryConfigResource1_10.java"}, "focal_method": {"identifier": "getAll", "parameters": "(RequestContext context)", "modifiers": "@Override public", "return": "SimpleObject", "body": "@Override\n\tpublic SimpleObject getAll(RequestContext context) throws ResponseException {\n\t\tOrderService orderService = Context.getOrderService();\n\t\t\n\t\tSimpleObject ret = new SimpleObject();\n\t\t// try/catch each of these to avoid failing in the case where one of these is not configured\n\t\ttry {\n\t\t\tret.put(\"drugRoutes\",\n\t\t\t    ConversionUtil.convertToRepresentation(orderService.getDrugRoutes(), context.getRepresentation()));\n\t\t}\n\t\tcatch (Exception ex) {}\n\t\ttry {\n\t\t\tret.put(\"drugDosingUnits\",\n\t\t\t    ConversionUtil.convertToRepresentation(orderService.getDrugDosingUnits(), context.getRepresentation()));\n\t\t}\n\t\tcatch (Exception ex) {}\n\t\ttry {\n\t\t\tret.put(\"drugDispensingUnits\",\n\t\t\t    ConversionUtil.convertToRepresentation(orderService.getDrugDispensingUnits(), context.getRepresentation()));\n\t\t}\n\t\tcatch (Exception ex) {}\n\t\ttry {\n\t\t\tret.put(\"durationUnits\",\n\t\t\t    ConversionUtil.convertToRepresentation(orderService.getDurationUnits(), context.getRepresentation()));\n\t\t}\n\t\tcatch (Exception ex) {}\n\t\ttry {\n\t\t\tret.put(\"testSpecimenSources\",\n\t\t\t    ConversionUtil.convertToRepresentation(orderService.getTestSpecimenSources(), context.getRepresentation()));\n\t\t}\n\t\tcatch (Exception ex) {}\n\t\ttry {\n\t\t\tret.put(\"orderFrequencies\",\n\t\t\t    ConversionUtil.convertToRepresentation(orderService.getOrderFrequencies(false), context.getRepresentation()));\n\t\t}\n\t\tcatch (Exception ex) {}\n\t\treturn ret;\n\t}", "signature": "SimpleObject getAll(RequestContext context)", "full_signature": "@Override public SimpleObject getAll(RequestContext context)", "class_method_signature": "OrderEntryConfigResource1_10.getAll(RequestContext context)", "testcase": false, "constructor": false, "invocations": ["getOrderService", "put", "convertToRepresentation", "getDrugRoutes", "getRepresentation", "put", "convertToRepresentation", "getDrugDosingUnits", "getRepresentation", "put", "convertToRepresentation", "getDrugDispensingUnits", "getRepresentation", "put", "convertToRepresentation", "getDurationUnits", "getRepresentation", "put", "convertToRepresentation", "getTestSpecimenSources", "getRepresentation", "put", "convertToRepresentation", "getOrderFrequencies", "getRepresentation"]}, "repository": {"repo_id": 6951233, "url": "https://github.com/openmrs/openmrs-module-webservices.rest", "language": "Java", "is_fork": false, "fork_count": 383, "stargazer_count": 46, "size": 7213, "license": "licensed"}}