{"test_class": {"identifier": "InteractTypeMapperFactoryWithFallbackTest", "superclass": "", "interfaces": "", "fields": [], "file": "eol-globi-lib/src/test/java/org/eol/globi/util/InteractTypeMapperFactoryWithFallbackTest.java"}, "test_case": {"identifier": "createAndIgnoreTermSecondMapper", "parameters": "()", "modifiers": "@Test public", "return": "void", "body": "@Test\n    public void createAndIgnoreTermSecondMapper() throws TermLookupServiceException {\n\n        InteractTypeMapperFactory factory1 = Mockito.mock(InteractTypeMapperFactory.class);\n        when(factory1.create()).thenThrow(new TermLookupServiceException(\"kaboom!\"));\n\n        InteractTypeMapper mapper = Mockito.mock(InteractTypeMapper.class);\n        InteractTypeMapperFactory factory2 = Mockito.mock(InteractTypeMapperFactory.class);\n        when(factory2.create()).thenReturn(mapper);\n\n        InteractTypeMapper interactTypeMapper\n                = new InteractTypeMapperFactoryWithFallback(factory1, factory2).create();\n\n        assertThat(interactTypeMapper, is(mapper));\n\n    }", "signature": "void createAndIgnoreTermSecondMapper()", "full_signature": "@Test public void createAndIgnoreTermSecondMapper()", "class_method_signature": "InteractTypeMapperFactoryWithFallbackTest.createAndIgnoreTermSecondMapper()", "testcase": true, "constructor": false, "invocations": ["mock", "thenThrow", "when", "create", "mock", "mock", "thenReturn", "when", "create", "create", "assertThat", "is"]}, "focal_class": {"identifier": "InteractTypeMapperFactoryWithFallback", "superclass": "", "interfaces": "implements InteractTypeMapperFactory", "fields": [{"original_string": "private final List<InteractTypeMapperFactory> factoryAlternatives;", "modifier": "private final", "type": "List<InteractTypeMapperFactory>", "declarator": "factoryAlternatives", "var_name": "factoryAlternatives"}], "methods": [{"identifier": "InteractTypeMapperFactoryWithFallback", "parameters": "(InteractTypeMapperFactory... factory)", "modifiers": "public", "return": "", "signature": " InteractTypeMapperFactoryWithFallback(InteractTypeMapperFactory... factory)", "full_signature": "public  InteractTypeMapperFactoryWithFallback(InteractTypeMapperFactory... factory)", "class_method_signature": "InteractTypeMapperFactoryWithFallback.InteractTypeMapperFactoryWithFallback(InteractTypeMapperFactory... factory)", "testcase": false, "constructor": true}, {"identifier": "create", "parameters": "()", "modifiers": "@Override public", "return": "InteractTypeMapper", "signature": "InteractTypeMapper create()", "full_signature": "@Override public InteractTypeMapper create()", "class_method_signature": "InteractTypeMapperFactoryWithFallback.create()", "testcase": false, "constructor": false}], "file": "eol-globi-lib/src/main/java/org/eol/globi/util/InteractTypeMapperFactoryWithFallback.java"}, "focal_method": {"identifier": "create", "parameters": "()", "modifiers": "@Override public", "return": "InteractTypeMapper", "body": "@Override\n    public InteractTypeMapper create() throws TermLookupServiceException {\n        InteractTypeMapper mapper = null;\n        TermLookupServiceException lastException = null;\n        for (InteractTypeMapperFactory factory : factoryAlternatives) {\n            try {\n                mapper = factory.create();\n                if (mapper != null) {\n                    break;\n                }\n            } catch (TermLookupServiceException ex) {\n                lastException = ex;\n            }\n        }\n        if (mapper == null) {\n            throw lastException == null\n                    ? new TermLookupServiceException(\"failed to create interaction type mapper\")\n                    : lastException;\n        }\n\n        return mapper;\n    }", "signature": "InteractTypeMapper create()", "full_signature": "@Override public InteractTypeMapper create()", "class_method_signature": "InteractTypeMapperFactoryWithFallback.create()", "testcase": false, "constructor": false, "invocations": ["create"]}, "repository": {"repo_id": 2478263, "url": "https://github.com/globalbioticinteractions/globalbioticinteractions", "stars": 49, "created": "9/28/2011 9:51:47 PM +00:00", "updates": "2020-01-17T17:47:05+00:00", "fork": "False", "license": "licensed"}}