{"test_class": {"identifier": "JCaptchaResourceReferenceSerializerTest", "superclass": "", "interfaces": "", "fields": [{"original_string": "@InjectMockComponents\n    private JCaptchaResourceReferenceSerializer jCaptchaResourceReferenceSerializer;", "modifier": "@InjectMockComponents\n    private", "type": "JCaptchaResourceReferenceSerializer", "declarator": "jCaptchaResourceReferenceSerializer", "var_name": "jCaptchaResourceReferenceSerializer"}, {"original_string": "@MockComponent\n    @Named(\"contextpath\")\n    private URLNormalizer<ExtendedURL> extendedURLNormalizer;", "modifier": "@MockComponent\n    @Named(\"contextpath\")\n    private", "type": "URLNormalizer<ExtendedURL>", "declarator": "extendedURLNormalizer", "var_name": "extendedURLNormalizer"}], "file": "xwiki-platform-core/xwiki-platform-captcha/xwiki-platform-captcha-jcaptcha/xwiki-platform-captcha-jcaptcha-api/src/test/java/org/xwiki/captcha/internal/JCaptchaResourceReferenceSerializerTest.java"}, "test_case": {"identifier": "serialize", "parameters": "()", "modifiers": "@Test public", "return": "void", "body": "@Test\n    public void serialize() throws UnsupportedResourceReferenceException, SerializeResourceReferenceException\n    {\n        JCaptchaResourceReference jCaptchaResourceReference = new JCaptchaResourceReference(\"fooType\", \"barEngine\");\n        ExtendedURL extendedURL = jCaptchaResourceReferenceSerializer.serialize(jCaptchaResourceReference);\n\n        verify(extendedURLNormalizer, times(1)).normalize(any());\n        List<String> segments = extendedURL.getSegments();\n        assertEquals(3, segments.size());\n        assertEquals(\"jcaptcha\", segments.get(0));\n        assertEquals(\"fooType\", segments.get(1));\n        assertEquals(\"barEngine\", segments.get(2));\n        assertTrue(extendedURL.getParameters().isEmpty());\n    }", "signature": "void serialize()", "full_signature": "@Test public void serialize()", "class_method_signature": "JCaptchaResourceReferenceSerializerTest.serialize()", "testcase": true, "constructor": false, "invocations": ["serialize", "normalize", "verify", "times", "any", "getSegments", "assertEquals", "size", "assertEquals", "get", "assertEquals", "get", "assertEquals", "get", "assertTrue", "isEmpty", "getParameters"]}, "focal_class": {"identifier": "JCaptchaResourceReferenceSerializer", "superclass": "", "interfaces": "implements\n    ResourceReferenceSerializer<JCaptchaResourceReference, ExtendedURL>", "fields": [{"original_string": "@Inject\n    @Named(\"contextpath\")\n    private URLNormalizer<ExtendedURL> extendedURLNormalizer;", "modifier": "@Inject\n    @Named(\"contextpath\")\n    private", "type": "URLNormalizer<ExtendedURL>", "declarator": "extendedURLNormalizer", "var_name": "extendedURLNormalizer"}], "methods": [{"identifier": "serialize", "parameters": "(JCaptchaResourceReference resource)", "modifiers": "@Override public", "return": "ExtendedURL", "signature": "ExtendedURL serialize(JCaptchaResourceReference resource)", "full_signature": "@Override public ExtendedURL serialize(JCaptchaResourceReference resource)", "class_method_signature": "JCaptchaResourceReferenceSerializer.serialize(JCaptchaResourceReference resource)", "testcase": false, "constructor": false}], "file": "xwiki-platform-core/xwiki-platform-captcha/xwiki-platform-captcha-jcaptcha/xwiki-platform-captcha-jcaptcha-api/src/main/java/org/xwiki/captcha/internal/JCaptchaResourceReferenceSerializer.java"}, "focal_method": {"identifier": "serialize", "parameters": "(JCaptchaResourceReference resource)", "modifiers": "@Override public", "return": "ExtendedURL", "body": "@Override\n    public ExtendedURL serialize(JCaptchaResourceReference resource)\n        throws SerializeResourceReferenceException, UnsupportedResourceReferenceException\n    {\n        List<String> segments = new ArrayList<>();\n\n        // Add the resource type segment.\n        segments.add(\"jcaptcha\");\n        segments.add(resource.getCaptchaType());\n        segments.add(resource.getEngine());\n\n        // Add all optional parameters\n        ExtendedURL extendedURL = new ExtendedURL(segments, resource.getParameters());\n\n        // Normalize the URL to add the Context Path since we want a full relative URL to be returned.\n        return this.extendedURLNormalizer.normalize(extendedURL);\n    }", "signature": "ExtendedURL serialize(JCaptchaResourceReference resource)", "full_signature": "@Override public ExtendedURL serialize(JCaptchaResourceReference resource)", "class_method_signature": "JCaptchaResourceReferenceSerializer.serialize(JCaptchaResourceReference resource)", "testcase": false, "constructor": false, "invocations": ["add", "add", "getCaptchaType", "add", "getEngine", "getParameters", "normalize"]}, "repository": {"repo_id": 1463490, "url": "https://github.com/xwiki/xwiki-platform", "stars": 495, "created": "3/10/2011 1:26:41 PM +00:00", "updates": "2020-01-27T14:12:16+00:00", "fork": "False", "license": "licensed"}}