{"test_class": {"identifier": "FileSystemMailContentStoreTest", "superclass": "", "interfaces": "", "fields": [{"original_string": "@XWikiTempDir\n    private File tmpDir;", "modifier": "@XWikiTempDir\n    private", "type": "File", "declarator": "tmpDir", "var_name": "tmpDir"}, {"original_string": "@InjectMockComponents\n    private FileSystemMailContentStore store;", "modifier": "@InjectMockComponents\n    private", "type": "FileSystemMailContentStore", "declarator": "store", "var_name": "store"}], "file": "xwiki-platform-core/xwiki-platform-mail/xwiki-platform-mail-send/xwiki-platform-mail-send-default/src/test/java/org/xwiki/mail/internal/FileSystemMailContentStoreTest.java"}, "test_case": {"identifier": "loadMessage", "parameters": "()", "modifiers": "@Test public", "return": "void", "body": "@Test\n    public void loadMessage() throws Exception\n    {\n        String batchId = UUID.randomUUID().toString();\n        String messageId = \"ar1vm0Wca42E/dDn3dsH8ogs3/s=\";\n        String mimeMessageId = \"<1128820400.0.1419205781342.JavaMail.contact@xwiki.org>\";\n\n        File batchDirectory =\n            new File(new File(this.tmpDir, this.store.ROOT_DIRECTORY), URLEncoder.encode(batchId,\"UTF-8\"));\n        batchDirectory.mkdirs();\n        File messageFile = new File(batchDirectory, URLEncoder.encode(messageId,\"UTF-8\"));\n        messageFile.createNewFile();\n\n        String newLine = System.getProperty(\"line.separator\");\n\n        try (FileWriter fileWriter = new FileWriter(messageFile, true)) {\n            // Unique string is <hashcode>.<id>.<currentTime>.JavaMail.<suffix>\n            fileWriter.append(\"Message-ID: \" + mimeMessageId + newLine);\n            fileWriter.append(\"MIME-Version: 1.0\" + newLine);\n            fileWriter.append(\"Content-Type: text/plain; charset=us-ascii\" + newLine);\n            fileWriter.append(\"Content-Transfer-Encoding: 7bit\" + newLine + newLine);\n            fileWriter.append(\"Lorem ipsum dolor sit amet, consectetur adipiscing elit\");\n        }\n\n        Session session = Session.getInstance(new Properties());\n        MimeMessage message = this.store.load(session, batchId, messageId);\n\n        assertEquals(mimeMessageId, message.getMessageID());\n        assertEquals(\"Lorem ipsum dolor sit amet, consectetur adipiscing elit\", message.getContent());\n    }", "signature": "void loadMessage()", "full_signature": "@Test public void loadMessage()", "class_method_signature": "FileSystemMailContentStoreTest.loadMessage()", "testcase": true, "constructor": false, "invocations": ["toString", "randomUUID", "encode", "mkdirs", "encode", "createNewFile", "getProperty", "append", "append", "append", "append", "append", "getInstance", "load", "assertEquals", "getMessageID", "assertEquals", "getContent"]}, "focal_class": {"identifier": "FileSystemMailContentStore", "superclass": "", "interfaces": "implements MailContentStore, Initializable", "fields": [{"original_string": "public static final String ROOT_DIRECTORY = \"mails\";", "modifier": "public static final", "type": "String", "declarator": "ROOT_DIRECTORY = \"mails\"", "var_name": "ROOT_DIRECTORY"}, {"original_string": "private File rootDirectory;", "modifier": "private", "type": "File", "declarator": "rootDirectory", "var_name": "rootDirectory"}, {"original_string": "@Inject\n    private Environment environment;", "modifier": "@Inject\n    private", "type": "Environment", "declarator": "environment", "var_name": "environment"}], "methods": [{"identifier": "initialize", "parameters": "()", "modifiers": "@Override public", "return": "void", "signature": "void initialize()", "full_signature": "@Override public void initialize()", "class_method_signature": "FileSystemMailContentStore.initialize()", "testcase": false, "constructor": false}, {"identifier": "save", "parameters": "(String batchId, ExtendedMimeMessage message)", "modifiers": "@Override public", "return": "void", "signature": "void save(String batchId, ExtendedMimeMessage message)", "full_signature": "@Override public void save(String batchId, ExtendedMimeMessage message)", "class_method_signature": "FileSystemMailContentStore.save(String batchId, ExtendedMimeMessage message)", "testcase": false, "constructor": false}, {"identifier": "load", "parameters": "(Session session, String batchId, String uniqueMessageId)", "modifiers": "@Override public", "return": "ExtendedMimeMessage", "signature": "ExtendedMimeMessage load(Session session, String batchId, String uniqueMessageId)", "full_signature": "@Override public ExtendedMimeMessage load(Session session, String batchId, String uniqueMessageId)", "class_method_signature": "FileSystemMailContentStore.load(Session session, String batchId, String uniqueMessageId)", "testcase": false, "constructor": false}, {"identifier": "delete", "parameters": "(String batchId, String uniqueMessageId)", "modifiers": "@Override public", "return": "void", "signature": "void delete(String batchId, String uniqueMessageId)", "full_signature": "@Override public void delete(String batchId, String uniqueMessageId)", "class_method_signature": "FileSystemMailContentStore.delete(String batchId, String uniqueMessageId)", "testcase": false, "constructor": false}, {"identifier": "extractTemporaryFilesFromHeaders", "parameters": "(ExtendedMimeMessage message)", "modifiers": "private", "return": "List<File>", "signature": "List<File> extractTemporaryFilesFromHeaders(ExtendedMimeMessage message)", "full_signature": "private List<File> extractTemporaryFilesFromHeaders(ExtendedMimeMessage message)", "class_method_signature": "FileSystemMailContentStore.extractTemporaryFilesFromHeaders(ExtendedMimeMessage message)", "testcase": false, "constructor": false}, {"identifier": "getBatchDirectory", "parameters": "(String batchId)", "modifiers": "private", "return": "File", "signature": "File getBatchDirectory(String batchId)", "full_signature": "private File getBatchDirectory(String batchId)", "class_method_signature": "FileSystemMailContentStore.getBatchDirectory(String batchId)", "testcase": false, "constructor": false}, {"identifier": "getMessageFile", "parameters": "(String batchId, String uniqueMessageId)", "modifiers": "private", "return": "File", "signature": "File getMessageFile(String batchId, String uniqueMessageId)", "full_signature": "private File getMessageFile(String batchId, String uniqueMessageId)", "class_method_signature": "FileSystemMailContentStore.getMessageFile(String batchId, String uniqueMessageId)", "testcase": false, "constructor": false}, {"identifier": "getURLEncoded", "parameters": "(final String toEncode)", "modifiers": "private static", "return": "String", "signature": "String getURLEncoded(final String toEncode)", "full_signature": "private static String getURLEncoded(final String toEncode)", "class_method_signature": "FileSystemMailContentStore.getURLEncoded(final String toEncode)", "testcase": false, "constructor": false}], "file": "xwiki-platform-core/xwiki-platform-mail/xwiki-platform-mail-send/xwiki-platform-mail-send-default/src/main/java/org/xwiki/mail/internal/FileSystemMailContentStore.java"}, "focal_method": {"identifier": "load", "parameters": "(Session session, String batchId, String uniqueMessageId)", "modifiers": "@Override public", "return": "ExtendedMimeMessage", "body": "@Override\n    public ExtendedMimeMessage load(Session session, String batchId, String uniqueMessageId) throws MailStoreException\n    {\n        File messageFile = null;\n        try {\n            messageFile = getMessageFile(batchId, uniqueMessageId);\n            InputStream is = new FileInputStream(messageFile);\n            return new ExtendedMimeMessage(session, is);\n        } catch (Exception e) {\n            throw new MailStoreException(String.format(\n                \"Failed to load message (id [%s], batch id [%s]) from file [%s]\",\n                uniqueMessageId, batchId, messageFile), e);\n        }\n    }", "signature": "ExtendedMimeMessage load(Session session, String batchId, String uniqueMessageId)", "full_signature": "@Override public ExtendedMimeMessage load(Session session, String batchId, String uniqueMessageId)", "class_method_signature": "FileSystemMailContentStore.load(Session session, String batchId, String uniqueMessageId)", "testcase": false, "constructor": false, "invocations": ["getMessageFile", "format"]}, "repository": {"repo_id": 1463490, "url": "https://github.com/xwiki/xwiki-platform", "stars": 495, "created": "3/10/2011 1:26:41 PM +00:00", "updates": "2020-01-27T14:12:16+00:00", "fork": "False", "license": "licensed"}}