{"test_class": {"identifier": "ConfigurationUtilTest", "superclass": "", "interfaces": "", "fields": [], "file": "oak-security-spi/src/test/java/org/apache/jackrabbit/oak/spi/security/authentication/ConfigurationUtilTest.java"}, "test_case": {"identifier": "testGetJr2Configuration", "parameters": "()", "modifiers": "@Test public", "return": "void", "body": "@Test\n    public void testGetJr2Configuration() {\n        Configuration c = ConfigurationUtil.getJackrabbit2Configuration(ConfigurationParameters.EMPTY);\n        AppConfigurationEntry[]  entries = c.getAppConfigurationEntry(\"any\");\n        assertEquals(3, entries.length);\n\n        assertEquals(GuestLoginModule.class.getName(), entries[0].getLoginModuleName());\n        assertEquals(AppConfigurationEntry.LoginModuleControlFlag.OPTIONAL, entries[0].getControlFlag());\n\n        assertEquals(\"org.apache.jackrabbit.oak.security.authentication.token.TokenLoginModule\", entries[1].getLoginModuleName());\n        assertEquals(AppConfigurationEntry.LoginModuleControlFlag.SUFFICIENT, entries[1].getControlFlag());\n\n        assertEquals(\"org.apache.jackrabbit.oak.security.authentication.user.LoginModuleImpl\", entries[2].getLoginModuleName());\n    }", "signature": "void testGetJr2Configuration()", "full_signature": "@Test public void testGetJr2Configuration()", "class_method_signature": "ConfigurationUtilTest.testGetJr2Configuration()", "testcase": true, "constructor": false, "invocations": ["getJackrabbit2Configuration", "getAppConfigurationEntry", "assertEquals", "assertEquals", "getName", "getLoginModuleName", "assertEquals", "getControlFlag", "assertEquals", "getLoginModuleName", "assertEquals", "getControlFlag", "assertEquals", "getLoginModuleName"]}, "focal_class": {"identifier": "ConfigurationUtil", "superclass": "", "interfaces": "", "fields": [], "methods": [{"identifier": "ConfigurationUtil", "parameters": "()", "modifiers": "private", "return": "", "signature": " ConfigurationUtil()", "full_signature": "private  ConfigurationUtil()", "class_method_signature": "ConfigurationUtil.ConfigurationUtil()", "testcase": false, "constructor": true}, {"identifier": "getDefaultConfiguration", "parameters": "(final ConfigurationParameters loginConfiguration)", "modifiers": "public static", "return": "Configuration", "signature": "Configuration getDefaultConfiguration(final ConfigurationParameters loginConfiguration)", "full_signature": "public static Configuration getDefaultConfiguration(final ConfigurationParameters loginConfiguration)", "class_method_signature": "ConfigurationUtil.getDefaultConfiguration(final ConfigurationParameters loginConfiguration)", "testcase": false, "constructor": false}, {"identifier": "getJackrabbit2Configuration", "parameters": "(final ConfigurationParameters loginConfiguration)", "modifiers": "public static", "return": "Configuration", "signature": "Configuration getJackrabbit2Configuration(final ConfigurationParameters loginConfiguration)", "full_signature": "public static Configuration getJackrabbit2Configuration(final ConfigurationParameters loginConfiguration)", "class_method_signature": "ConfigurationUtil.getJackrabbit2Configuration(final ConfigurationParameters loginConfiguration)", "testcase": false, "constructor": false}], "file": "oak-security-spi/src/main/java/org/apache/jackrabbit/oak/spi/security/authentication/ConfigurationUtil.java"}, "focal_method": {"identifier": "getJackrabbit2Configuration", "parameters": "(final ConfigurationParameters loginConfiguration)", "modifiers": "public static", "return": "Configuration", "body": "public static Configuration getJackrabbit2Configuration(final ConfigurationParameters loginConfiguration) {\n        return new Configuration() {\n            @Override\n            public AppConfigurationEntry[] getAppConfigurationEntry(String applicationName) {\n                Map<String, ?> options = loginConfiguration.getConfigValue(applicationName, Collections.<String, Object>emptyMap());\n                return new AppConfigurationEntry[]{\n                        new GuestEntry(options),\n                        new TokenEntry(options),\n                        new DefaultEntry(options)};\n            }\n        };\n    }", "signature": "Configuration getJackrabbit2Configuration(final ConfigurationParameters loginConfiguration)", "full_signature": "public static Configuration getJackrabbit2Configuration(final ConfigurationParameters loginConfiguration)", "class_method_signature": "ConfigurationUtil.getJackrabbit2Configuration(final ConfigurationParameters loginConfiguration)", "testcase": false, "constructor": false, "invocations": ["getConfigValue", "emptyMap"]}, "repository": {"repo_id": 3657930, "url": "https://github.com/apache/jackrabbit-oak", "stars": 291, "created": "3/8/2012 8:00:14 AM +00:00", "updates": "2020-01-27T10:53:13+00:00", "fork": "False", "license": "licensed"}}