{"test_class": {"identifier": "TemplateSupportInstructionPackageTest", "superclass": "extends BaseTest", "interfaces": "", "fields": [{"original_string": "public static final int EXPECTED = 2;", "modifier": "public static final", "type": "int", "declarator": "EXPECTED = 2", "var_name": "EXPECTED"}], "file": "plugin-sdk/implementation/src/test/java/org/onehippo/cms7/essentials/dashboard/packaging/TemplateSupportInstructionPackageTest.java"}, "test_case": {"identifier": "testInstructionPackage", "parameters": "()", "modifiers": "@Test public", "return": "void", "body": "@Test\n    public void testInstructionPackage() throws Exception {\n        InstructionPackage instructionPackage = new TemplateSupportInstructionPackage();\n        injector.autowireBean(instructionPackage);\n        final String instructionPath = instructionPackage.getInstructionPath();\n        assertEquals(\"Expected default path\", instructionPath, EssentialConst.DEFAULT_INSTRUCTIONS_PATH);\n        final Map<String, Object> properties = instructionPackage.getProperties();\n        assertEquals(\"Expected empty property set\", 0, properties.size());\n        final Set<String> groupNames = instructionPackage.groupNames();\n        assertEquals(\"Expected default group names\", EXPECTED, groupNames.size());\n        final InstructionParser parser = instructionPackage.getInstructionParser();\n        assertNotNull(parser);\n        final EventBus bus = instructionPackage.getEventBus();\n        assertNotNull(bus);\n        final Instructions instructions = instructionPackage.getInstructions();\n        assertEquals(\"Expected no instructions\", null, instructions);\n\n    }", "signature": "void testInstructionPackage()", "full_signature": "@Test public void testInstructionPackage()", "class_method_signature": "TemplateSupportInstructionPackageTest.testInstructionPackage()", "testcase": true, "constructor": false, "invocations": ["autowireBean", "getInstructionPath", "assertEquals", "getProperties", "assertEquals", "size", "groupNames", "assertEquals", "size", "getInstructionParser", "assertNotNull", "getEventBus", "assertNotNull", "getInstructions", "assertEquals"]}, "focal_class": {"identifier": "TemplateSupportInstructionPackage", "superclass": "extends DefaultInstructionPackage", "interfaces": "", "fields": [], "methods": [{"identifier": "TemplateSupportInstructionPackage", "parameters": "()", "modifiers": "public", "return": "", "signature": " TemplateSupportInstructionPackage()", "full_signature": "public  TemplateSupportInstructionPackage()", "class_method_signature": "TemplateSupportInstructionPackage.TemplateSupportInstructionPackage()", "testcase": false, "constructor": true}, {"identifier": "TemplateSupportInstructionPackage", "parameters": "(final String path)", "modifiers": "public", "return": "", "signature": " TemplateSupportInstructionPackage(final String path)", "full_signature": "public  TemplateSupportInstructionPackage(final String path)", "class_method_signature": "TemplateSupportInstructionPackage.TemplateSupportInstructionPackage(final String path)", "testcase": false, "constructor": true}, {"identifier": "groupNames", "parameters": "()", "modifiers": "@Override public", "return": "Set<String>", "signature": "Set<String> groupNames()", "full_signature": "@Override public Set<String> groupNames()", "class_method_signature": "TemplateSupportInstructionPackage.groupNames()", "testcase": false, "constructor": false}], "file": "plugin-sdk/implementation/src/main/java/org/onehippo/cms7/essentials/dashboard/packaging/TemplateSupportInstructionPackage.java"}, "focal_method": {"identifier": "groupNames", "parameters": "()", "modifiers": "@Override public", "return": "Set<String>", "body": "@Override\n    public Set<String> groupNames() {\n        final Boolean sampleData = Boolean.valueOf((String) getProperties().get(EssentialConst.PROP_SAMPLE_DATA));\n        final String templateName = (String) getProperties().get(EssentialConst.PROP_TEMPLATE_NAME);\n        final String templateGroup = Strings.isNullOrEmpty(templateName) ? \"jsp\" : templateName;\n        if (sampleData) {\n            return new ImmutableSet.Builder<String>()\n                    .add(EssentialConst.INSTRUCTION_GROUP_DEFAULT)\n                    .add(EssentialConst.PROP_SAMPLE_DATA)\n                    .add(templateGroup).build();\n        }\n        return new ImmutableSet.Builder<String>()\n                .add(EssentialConst.INSTRUCTION_GROUP_DEFAULT)\n                .add(templateGroup).build();\n    }", "signature": "Set<String> groupNames()", "full_signature": "@Override public Set<String> groupNames()", "class_method_signature": "TemplateSupportInstructionPackage.groupNames()", "testcase": false, "constructor": false, "invocations": ["valueOf", "get", "getProperties", "get", "getProperties", "isNullOrEmpty", "build", "add", "add", "add", "build", "add", "add"]}, "repository": {"repo_id": 12812578, "url": "https://github.com/onehippo/essentials", "language": "Java", "is_fork": false, "fork_count": 14, "stargazer_count": 9, "size": 52784, "license": "licensed"}}