{"test_class": {"identifier": "InternalFunctionMetricsTest", "superclass": "extends FlexPmdTestBase", "interfaces": "", "fields": [], "file": "flex-pmd-metrics/src/test/java/com/adobe/ac/pmd/metrics/InternalFunctionMetricsTest.java"}, "test_case": {"identifier": "testCreate", "parameters": "()", "modifiers": "@Test public", "return": "void", "body": "@Test\n   public void testCreate() throws PMDException\n   {\n      final IFlexFile file = getTestFiles().get( \"bug.FlexPMD60.as\" );\n      final IParserNode ast = FileSetUtils.buildAst( file );\n      final IClass classNode = NodeFactory.createPackage( ast ).getClassNode();\n      final InternalFunctionMetrics classMetrics = InternalFunctionMetrics.create( new ProjectMetrics(),\n                                                                                   \"bug\",\n                                                                                   classNode );\n\n      assertEquals( 1,\n                    classMetrics.getMultipleLineCommentInClass() );\n   }", "signature": "void testCreate()", "full_signature": "@Test public void testCreate()", "class_method_signature": "InternalFunctionMetricsTest.testCreate()", "testcase": true, "constructor": false, "invocations": ["get", "getTestFiles", "buildAst", "getClassNode", "createPackage", "create", "assertEquals", "getMultipleLineCommentInClass"]}, "focal_class": {"identifier": "InternalFunctionMetrics", "superclass": "", "interfaces": "", "fields": [{"original_string": "private final int asDocsInClass;", "modifier": "private final", "type": "int", "declarator": "asDocsInClass", "var_name": "asDocsInClass"}, {"original_string": "private final int multipleLineCommentInClass;", "modifier": "private final", "type": "int", "declarator": "multipleLineCommentInClass", "var_name": "multipleLineCommentInClass"}, {"original_string": "private final int ncssInClass;", "modifier": "private final", "type": "int", "declarator": "ncssInClass", "var_name": "ncssInClass"}], "methods": [{"identifier": "create", "parameters": "( final ProjectMetrics metrics,\n                                                 final String packageFullName,\n                                                 final IClass classNode )", "modifiers": "public static", "return": "InternalFunctionMetrics", "signature": "InternalFunctionMetrics create( final ProjectMetrics metrics,\n                                                 final String packageFullName,\n                                                 final IClass classNode )", "full_signature": "public static InternalFunctionMetrics create( final ProjectMetrics metrics,\n                                                 final String packageFullName,\n                                                 final IClass classNode )", "class_method_signature": "InternalFunctionMetrics.create( final ProjectMetrics metrics,\n                                                 final String packageFullName,\n                                                 final IClass classNode )", "testcase": false, "constructor": false}, {"identifier": "InternalFunctionMetrics", "parameters": "( final int ncssInClassToBeSet,\n                                    final int asDocsInClassToBeSet,\n                                    final int multipleLineCommentInClassToBeSet )", "modifiers": "private", "return": "", "signature": " InternalFunctionMetrics( final int ncssInClassToBeSet,\n                                    final int asDocsInClassToBeSet,\n                                    final int multipleLineCommentInClassToBeSet )", "full_signature": "private  InternalFunctionMetrics( final int ncssInClassToBeSet,\n                                    final int asDocsInClassToBeSet,\n                                    final int multipleLineCommentInClassToBeSet )", "class_method_signature": "InternalFunctionMetrics.InternalFunctionMetrics( final int ncssInClassToBeSet,\n                                    final int asDocsInClassToBeSet,\n                                    final int multipleLineCommentInClassToBeSet )", "testcase": false, "constructor": true}, {"identifier": "getAsDocsInClass", "parameters": "()", "modifiers": "public", "return": "int", "signature": "int getAsDocsInClass()", "full_signature": "public int getAsDocsInClass()", "class_method_signature": "InternalFunctionMetrics.getAsDocsInClass()", "testcase": false, "constructor": false}, {"identifier": "getMultipleLineCommentInClass", "parameters": "()", "modifiers": "public", "return": "int", "signature": "int getMultipleLineCommentInClass()", "full_signature": "public int getMultipleLineCommentInClass()", "class_method_signature": "InternalFunctionMetrics.getMultipleLineCommentInClass()", "testcase": false, "constructor": false}, {"identifier": "getNcssInClass", "parameters": "()", "modifiers": "public", "return": "int", "signature": "int getNcssInClass()", "full_signature": "public int getNcssInClass()", "class_method_signature": "InternalFunctionMetrics.getNcssInClass()", "testcase": false, "constructor": false}], "file": "flex-pmd-metrics/src/main/java/com/adobe/ac/pmd/metrics/InternalFunctionMetrics.java"}, "focal_method": {"identifier": "create", "parameters": "( final ProjectMetrics metrics,\n                                                 final String packageFullName,\n                                                 final IClass classNode )", "modifiers": "public static", "return": "InternalFunctionMetrics", "body": "public static InternalFunctionMetrics create( final ProjectMetrics metrics,\n                                                 final String packageFullName,\n                                                 final IClass classNode )\n   {\n      int ncssInClass = 0;\n      int asDocsInClass = 0;\n      int multipleLineCommentInClass = 0;\n\n      for ( final IFunction function : classNode.getFunctions() )\n      {\n         final int multipleDoc = MetricUtils.computeMultiLineComments( function );\n         final int asDocs = MetricUtils.computeAsDocs( function );\n\n         ncssInClass += function.getStatementNbInBody();\n         multipleLineCommentInClass += multipleDoc;\n\n         asDocsInClass += asDocs;\n\n         metrics.getFunctionMetrics().add( FunctionMetrics.create( packageFullName,\n                                                                   classNode,\n                                                                   function,\n                                                                   asDocs,\n                                                                   multipleDoc ) );\n      }\n\n      for ( final IAttribute attribute : classNode.getAttributes() )\n      {\n         asDocsInClass += MetricUtils.computeAsDocs( attribute );\n      }\n\n      return new InternalFunctionMetrics( ncssInClass, asDocsInClass, multipleLineCommentInClass );\n   }", "signature": "InternalFunctionMetrics create( final ProjectMetrics metrics,\n                                                 final String packageFullName,\n                                                 final IClass classNode )", "full_signature": "public static InternalFunctionMetrics create( final ProjectMetrics metrics,\n                                                 final String packageFullName,\n                                                 final IClass classNode )", "class_method_signature": "InternalFunctionMetrics.create( final ProjectMetrics metrics,\n                                                 final String packageFullName,\n                                                 final IClass classNode )", "testcase": false, "constructor": false, "invocations": ["getFunctions", "computeMultiLineComments", "computeAsDocs", "getStatementNbInBody", "add", "getFunctionMetrics", "create", "getAttributes", "computeAsDocs"]}, "repository": {"repo_id": 4494450, "url": "https://github.com/PeterHoeche/adobe-flex-pmd", "language": "Java", "is_fork": false, "fork_count": 4, "stargazer_count": 9, "size": 8395, "license": "licensed"}}